{
  "schema_version": "1.0",
  "manifest_id": "AI-SF-001-template",
  "state": "DRAFT",
  "created_at": "2026-07-29T00:00:00+08:00",
  "source_policy": {
    "raw_content_in_git": false,
    "raw_content_in_model_request": false,
    "local_manifest_only": true
  },
  "required_buckets": [
    {"bucket": "RULE_HIT", "minimum_samples": 1},
    {"bucket": "PUBLISHED_ALLOW", "minimum_samples": 3},
    {"bucket": "RULE_HIT_HUMAN_ALLOW", "minimum_samples": 1},
    {"bucket": "CONTEXTUAL_VARIANT", "minimum_samples": 1}
  ],
  "samples": []
}
